{
  "$schema": "../../docs/zh_cn/schemas/recipe/blueprint_research_recipe.schema.json",
  "type": "machine_max:blueprint_research",
  "research_cost": 100,
  "research_ingredients": [
    {
      "ingredient": {
        "item": "minecraft:iron_ingot"
      },
      "count": 2
    },
    {
      "ingredient": {
        "tag": "c:empty_blueprint"
      },
      "count": 1
    }
  ],
  "icon": "machine_max:textures/icon/wine_fox/wine_fox_wheel_icon.png",
  "description": "research.machine_max.wine_fox_wheel_blueprint.desc",
  "unlock_recipe": "machine_max:part_fabricating/wine_fox_wheel"
}
